{
  "mapVersion": "atg.assurance-coverage-map.local.v1",
  "runId": "m162_run_8579ed4adb8cb7d914bc130a",
  "entries": [
    {
      "controlId": "CTRL-EXACT-001",
      "controlObjective": "Bind authority to one canonical action",
      "concern": "Action mutation",
      "implementationComponent": "exact-action GatePass",
      "applicableCases": [
        "01_exact_authorised_purchase",
        "02_quantity_substitution",
        "03_supplier_substitution"
      ],
      "evidenceReference": "01_exact_authorised_purchase,02_quantity_substitution,03_supplier_substitution",
      "evidenceDigest": "sha256:a7175ba7e846d536dc7cc89ca2d2e478d61a0520af0ad9553492698097d92f2f",
      "acceptanceTestReference": "test:m161:ctrl-exact-001",
      "status": "DEMONSTRATED",
      "explanation": "Canonical action binding accepts the exact action and rejects mutations.",
      "knownLimitation": "Local fixture signatures only.",
      "verificationMethod": "Recompute source-case and receipt digests.",
      "entryDigest": "sha256:e68e41482b1be3b41a0da9cd30023e2f907ea345fa5c0463529139da0d17918e"
    },
    {
      "controlId": "CTRL-MANDATE-001",
      "controlObjective": "Enforce human mandate boundaries",
      "concern": "Self-authorisation",
      "implementationComponent": "exact-action authority evaluator",
      "applicableCases": [
        "01_exact_authorised_purchase",
        "09_authority_expansion_attempt"
      ],
      "evidenceReference": "01_exact_authorised_purchase,09_authority_expansion_attempt",
      "evidenceDigest": "sha256:273ac10f9a9cd6c5c170f820beccb95316e9780701bb4d4e0ea7f1d3b46b838b",
      "acceptanceTestReference": "test:m161:ctrl-mandate-001",
      "status": "DEMONSTRATED",
      "explanation": "The valid mandate passes and agent expansion claims reject.",
      "knownLimitation": "Synthetic registered authority only.",
      "verificationMethod": "Verify cases 01 and 09.",
      "entryDigest": "sha256:9c7e682efe824c1b25199d4c24068729e247e61b4626d035534e2510087a4a9a"
    },
    {
      "controlId": "CTRL-MUTATION-001",
      "controlObjective": "Detect supplier, quantity and price changes",
      "concern": "Commercial-term substitution",
      "implementationComponent": "business policy contract",
      "applicableCases": [
        "02_quantity_substitution",
        "03_supplier_substitution",
        "04_price_band_breach"
      ],
      "evidenceReference": "02_quantity_substitution,03_supplier_substitution,04_price_band_breach",
      "evidenceDigest": "sha256:4b29fc80aa97808595c3121d745040168151c40ea86a19f63dd2098921b6a726",
      "acceptanceTestReference": "test:m161:ctrl-mutation-001",
      "status": "DEMONSTRATED",
      "explanation": "Quantity and supplier reject; the bounded price band refers.",
      "knownLimitation": "Only the fixture action family is covered.",
      "verificationMethod": "Verify outcomes and reason codes.",
      "entryDigest": "sha256:96fb2a984cea885eb4204011ece28837043920513ab40c0111778a6c511985c7"
    },
    {
      "controlId": "CTRL-OUTCOME-001",
      "controlObjective": "Keep ACCEPT, REJECT, REFER and revocation distinct",
      "concern": "Outcome ambiguity",
      "implementationComponent": "gateway plus lifecycle store",
      "applicableCases": [
        "01_exact_authorised_purchase",
        "04_price_band_breach",
        "06_gatepass_revocation"
      ],
      "evidenceReference": "01_exact_authorised_purchase,04_price_band_breach,06_gatepass_revocation",
      "evidenceDigest": "sha256:e45ff1b46e9bc50dc05003ff3a124d73e065ea28e2e9f66e9afacc79b988e882",
      "acceptanceTestReference": "test:m161:ctrl-outcome-001",
      "status": "DEMONSTRATED",
      "explanation": "Distinct evidence exists for acceptance, refusal/referral and revocation.",
      "knownLimitation": "REVOKE is an internal lifecycle control, not an MCP verdict.",
      "verificationMethod": "Verify cases and revocation receipt reference.",
      "entryDigest": "sha256:e95810da2e46d96f2f3f5930648e94790933bfd80f5fa06f443b89dc2c0d9733"
    },
    {
      "controlId": "CTRL-SHADOW-001",
      "controlObjective": "Prevent Shadow Mode authority",
      "concern": "Observation becoming permission",
      "implementationComponent": "Shadow Decision Receipt",
      "applicableCases": [
        "07_shadow_mode"
      ],
      "evidenceReference": "07_shadow_mode",
      "evidenceDigest": "sha256:968843376c96ae8f32fe7ec958a84614b5e5a952efc7d9acb946201eca4af16c",
      "acceptanceTestReference": "test:m161:ctrl-shadow-001",
      "status": "DEMONSTRATED",
      "explanation": "Shadow would accept but issues no GatePass.",
      "knownLimitation": "One synthetic policy fixture.",
      "verificationMethod": "Verify Shadow receipt and zero GatePass metric.",
      "entryDigest": "sha256:6fe84d315f60c9abc96701aa9996e0692c99f7ab2413a84f50793295ccce6eb3"
    },
    {
      "controlId": "CTRL-ONEUSE-001",
      "controlObjective": "Prevent GatePass replay",
      "concern": "Duplicate execution",
      "implementationComponent": "durable lifecycle CAS",
      "applicableCases": [
        "01_exact_authorised_purchase",
        "05_gatepass_reuse"
      ],
      "evidenceReference": "01_exact_authorised_purchase,05_gatepass_reuse",
      "evidenceDigest": "sha256:c95db64ad404ffafa13317e99b16230cd94fe3780692e7786afac126bf9ca379",
      "acceptanceTestReference": "test:m161:ctrl-oneuse-001",
      "status": "DEMONSTRATED",
      "explanation": "Consumed authority is blocked after restart.",
      "knownLimitation": "Single-process store only.",
      "verificationMethod": "Verify EXECUTED lifecycle and replay rejection.",
      "entryDigest": "sha256:10bbc973ac285d3511971a2806a8ba858ce9f53d6c14d00c6f7c9082a8630c82"
    },
    {
      "controlId": "CTRL-EXPIRY-001",
      "controlObjective": "Reject expired or revoked authority",
      "concern": "Stale authority",
      "implementationComponent": "lifecycle expiry and revocation",
      "applicableCases": [
        "06_gatepass_revocation"
      ],
      "evidenceReference": "06_gatepass_revocation",
      "evidenceDigest": "sha256:76e4a96a284da81509bd8f5bffdae583befe6f76564dc277b4780780bc27118f",
      "acceptanceTestReference": "test:m161:ctrl-expiry-001",
      "status": "PARTIALLY_DEMONSTRATED",
      "explanation": "Revocation is in the ten-case run; expiry is proved by the M161 acceptance suite.",
      "knownLimitation": "Expiry is test evidence rather than a named ten-case outcome.",
      "verificationMethod": "Run the M161 expired-authority test.",
      "entryDigest": "sha256:2a2566cf7cc25ce1f7259fe345faf7990acc261adb2ab9606a254eeea6fdde45"
    },
    {
      "controlId": "CTRL-EXPOSURE-001",
      "controlObjective": "Enforce aggregate exposure",
      "concern": "Many small actions bypass ceiling",
      "implementationComponent": "aggregate exposure ledger",
      "applicableCases": [
        "08_aggregate_ceiling"
      ],
      "evidenceReference": "08_aggregate_ceiling",
      "evidenceDigest": "sha256:9b841597edf04b2ef3761b7a092e2e6fe77dc8915ed031aff900a7d8b6a1f3b8",
      "acceptanceTestReference": "test:m161:ctrl-exposure-001",
      "status": "DEMONSTRATED",
      "explanation": "Two outstanding actions count and the third refers.",
      "knownLimitation": "No cross-currency conversion.",
      "verificationMethod": "Verify case 08 and exposure reason code.",
      "entryDigest": "sha256:baed4adbf4619a1182dd569afbb40f43b4bc9968c59c5acec62abfee568833de"
    },
    {
      "controlId": "CTRL-STOP-001",
      "controlObjective": "Persist emergency stop",
      "concern": "Continued issuance during incident",
      "implementationComponent": "durable emergency-stop record",
      "applicableCases": [
        "10_emergency_recovery_lifecycle"
      ],
      "evidenceReference": "10_emergency_recovery_lifecycle",
      "evidenceDigest": "sha256:655b5cbd26d6fe381eb7c207dc2a35a1eb7a411566d77b2da2dda2c8ca049501",
      "acceptanceTestReference": "test:m161:ctrl-stop-001",
      "status": "DEMONSTRATED",
      "explanation": "Stop state survives restart and blocks progression.",
      "knownLimitation": "Global local-gateway scope only.",
      "verificationMethod": "Verify case 10 evidence codes.",
      "entryDigest": "sha256:2b5c051b644497d51b27b4780d8257315800f0ebc0e2420ee59c481aff889770"
    },
    {
      "controlId": "CTRL-RESTART-001",
      "controlObjective": "Persist nonce, revocation and exposure",
      "concern": "State loss on restart",
      "implementationComponent": "local durable store",
      "applicableCases": [
        "05_gatepass_reuse",
        "06_gatepass_revocation",
        "10_emergency_recovery_lifecycle"
      ],
      "evidenceReference": "05_gatepass_reuse,06_gatepass_revocation,10_emergency_recovery_lifecycle",
      "evidenceDigest": "sha256:ba1eb60da76f2361e68e166b0c0919cc426aa17c24a33e370286b442f99894d2",
      "acceptanceTestReference": "test:m161:ctrl-restart-001",
      "status": "DEMONSTRATED",
      "explanation": "All three evidence classes survive restart.",
      "knownLimitation": "No multi-process guarantee.",
      "verificationMethod": "Verify restart evidence codes.",
      "entryDigest": "sha256:872918d29cfcc2e2b0fc9cd4f2e21e329378c0fef5aff449744d70c0a788e576"
    },
    {
      "controlId": "CTRL-CRASH-001",
      "controlObjective": "Avoid retry after uncertain effect",
      "concern": "Duplicate effect after crash",
      "implementationComponent": "UNKNOWN reconciliation",
      "applicableCases": [
        "10_emergency_recovery_lifecycle"
      ],
      "evidenceReference": "10_emergency_recovery_lifecycle",
      "evidenceDigest": "sha256:655b5cbd26d6fe381eb7c207dc2a35a1eb7a411566d77b2da2dda2c8ca049501",
      "acceptanceTestReference": "test:m161:ctrl-crash-001",
      "status": "DEMONSTRATED",
      "explanation": "UNKNOWN is not retried and needs explicit reconciliation.",
      "knownLimitation": "No real external acknowledgement source.",